{
  "$schema": "https://json-schema.org/draft/2020-12/schema",
  "title": "language_grove game manifest",
  "type": "object",
  "additionalProperties": false,
  "required": [
    "id",
    "worldIds",
    "recipes"
  ],
  "properties": {
    "id": {
      "const": "language_grove"
    },
    "worldIds": {
      "type": "array",
      "items": {
        "type": "string"
      }
    },
    "defaults": {
      "type": "object",
      "additionalProperties": false,
      "properties": {
        "recipeId": {
          "type": "string"
        },
        "timeLimit": {
          "type": "number"
        },
        "goal": {
          "type": "object",
          "additionalProperties": false,
          "required": [
            "type",
            "value"
          ],
          "properties": {
            "type": {
              "type": "string"
            },
            "value": {
              "type": "number"
            }
          }
        },
        "clearReward": {
          "type": "number"
        },
        "bonusTiers": {
          "type": "array",
          "items": {
            "type": "object",
            "additionalProperties": false,
            "required": [
              "threshold",
              "reward"
            ],
            "properties": {
              "threshold": {
                "type": "number"
              },
              "reward": {
                "type": "number"
              }
            }
          }
        }
      }
    },
    "worldSelect": {
      "type": "object",
      "additionalProperties": false,
      "properties": {
        "enabled": {
          "type": "boolean"
        },
        "backgroundPath": {
          "type": "string"
        }
      }
    },
    "levelSelect": {
      "type": "object",
      "additionalProperties": false,
      "properties": {
        "enabled": {
          "type": "boolean"
        },
        "backgroundPath": {
          "type": "string"
        },
        "slots": {
          "type": "array",
          "items": {
            "type": "object",
            "additionalProperties": false,
            "required": [
              "slot",
              "x",
              "y",
              "r"
            ],
            "properties": {
              "slot": {
                "type": "number"
              },
              "x": {
                "type": "number"
              },
              "y": {
                "type": "number"
              },
              "r": {
                "type": "number"
              }
            }
          }
        }
      }
    },
    "arcade": {
      "type": "object",
      "additionalProperties": false,
      "properties": {
        "enabled": {
          "type": "boolean"
        },
        "recipeIds": {
          "type": "array",
          "items": {
            "type": "string"
          }
        },
        "weights": {
          "type": "object",
          "additionalProperties": {
            "type": "number"
          }
        }
      }
    },
    "recipes": {
      "type": "object",
      "additionalProperties": {
        "oneOf": [
          {
            "type": "object",
            "additionalProperties": false,
            "required": [
              "kind",
              "title",
              "prompt",
              "rules",
              "scoring"
            ],
            "properties": {
              "kind": {
                "const": "collect_letters"
              },
              "title": {
                "type": "string"
              },
              "prompt": {
                "type": "string"
              },
              "rules": {
                "type": "object",
                "additionalProperties": false,
                "required": [
                  "letterSet",
                  "fallSpeed"
                ],
                "properties": {
                  "letterSet": {
                    "type": "string",
                    "enum": [
                      "vowels",
                      "consonants",
                      "word_letters"
                    ]
                  },
                  "fallSpeed": {
                    "type": "number"
                  },
                  "targetWord": {
                    "type": "string"
                  },
                  "itemCount": {
                    "type": "number"
                  }
                }
              },
              "scoring": {
                "type": "object",
                "additionalProperties": false,
                "required": [
                  "pointsPerCorrect",
                  "wrongPenalty"
                ],
                "properties": {
                  "pointsPerCorrect": {
                    "type": "number"
                  },
                  "wrongPenalty": {
                    "type": "number"
                  }
                }
              }
            }
          },
          {
            "type": "object",
            "additionalProperties": false,
            "required": [
              "kind",
              "title",
              "prompt",
              "rules",
              "scoring"
            ],
            "properties": {
              "kind": {
                "const": "collect_category_words"
              },
              "title": {
                "type": "string"
              },
              "prompt": {
                "type": "string"
              },
              "rules": {
                "type": "object",
                "additionalProperties": false,
                "required": [
                  "category",
                  "fallSpeed"
                ],
                "properties": {
                  "category": {
                    "type": "string"
                  },
                  "fallSpeed": {
                    "type": "number"
                  },
                  "itemCount": {
                    "type": "number"
                  }
                }
              },
              "scoring": {
                "type": "object",
                "additionalProperties": false,
                "required": [
                  "pointsPerCorrect",
                  "wrongPenalty"
                ],
                "properties": {
                  "pointsPerCorrect": {
                    "type": "number"
                  },
                  "wrongPenalty": {
                    "type": "number"
                  }
                }
              }
            }
          },
          {
            "type": "object",
            "additionalProperties": false,
            "required": [
              "kind",
              "title",
              "prompt",
              "rules",
              "scoring"
            ],
            "properties": {
              "kind": {
                "const": "choice_prompt"
              },
              "title": {
                "type": "string"
              },
              "prompt": {
                "type": "string"
              },
              "rules": {
                "type": "object",
                "additionalProperties": false,
                "required": [
                  "promptSet",
                  "fallSpeed",
                  "answerCount"
                ],
                "properties": {
                  "promptSet": {
                    "type": "string",
                    "enum": [
                      "sentence_completion",
                      "opposites",
                      "synonyms",
                      "riddle"
                    ]
                  },
                  "fallSpeed": {
                    "type": "number"
                  },
                  "answerCount": {
                    "type": "number"
                  }
                }
              },
              "scoring": {
                "type": "object",
                "additionalProperties": false,
                "required": [
                  "pointsPerCorrect",
                  "wrongPenalty"
                ],
                "properties": {
                  "pointsPerCorrect": {
                    "type": "number"
                  },
                  "wrongPenalty": {
                    "type": "number"
                  }
                }
              }
            }
          }
        ]
      }
    }
  }
}
