{
  "id": "language_grove",
  "worldIds": ["main"],
  "worldSelect": {
    "enabled": false
  },
  "levelSelect": {
    "enabled": false
  },
  "arcade": {
    "enabled": true,
    "recipeIds": [
      "vowel_catch",
      "consonant_catch",
      "animal_words",
      "food_words",
      "sentence_finish",
      "opposites",
      "synonyms",
      "riddle_catch"
    ],
    "weights": {
      "vowel_catch": 2,
      "consonant_catch": 2,
      "animal_words": 1,
      "food_words": 1,
      "sentence_finish": 1,
      "opposites": 1,
      "synonyms": 1,
      "riddle_catch": 1
    }
  },
  "recipes": {
    "vowel_catch": {
      "kind": "collect_letters",
      "title": "Vowel Catch",
      "prompt": "Catch the Vowels!",
      "rules": {
        "letterSet": "vowels",
        "fallSpeed": 1,
        "itemCount": 5
      },
      "scoring": {
        "pointsPerCorrect": 5,
        "wrongPenalty": 1
      }
    },
    "consonant_catch": {
      "kind": "collect_letters",
      "title": "Consonant Catch",
      "prompt": "Catch the Consonants!",
      "rules": {
        "letterSet": "consonants",
        "fallSpeed": 1,
        "itemCount": 5
      },
      "scoring": {
        "pointsPerCorrect": 5,
        "wrongPenalty": 1
      }
    },
    "animal_words": {
      "kind": "collect_category_words",
      "title": "Animal Words",
      "prompt": "Catch: ANIMALS",
      "rules": {
        "category": "animals",
        "fallSpeed": 1,
        "itemCount": 5
      },
      "scoring": {
        "pointsPerCorrect": 8,
        "wrongPenalty": 1
      }
    },
    "food_words": {
      "kind": "collect_category_words",
      "title": "Food Words",
      "prompt": "Catch: FOODS",
      "rules": {
        "category": "foods",
        "fallSpeed": 1,
        "itemCount": 5
      },
      "scoring": {
        "pointsPerCorrect": 8,
        "wrongPenalty": 1
      }
    },
    "category_stream": {
      "kind": "collect_category_words",
      "title": "Category Catch",
      "prompt": "Catch the matching words!",
      "rules": {
        "category": "animals",
        "fallSpeed": 1,
        "itemCount": 5
      },
      "scoring": {
        "pointsPerCorrect": 8,
        "wrongPenalty": 1
      }
    },
    "letters_in_word": {
      "kind": "collect_letters",
      "title": "Letters In Word",
      "prompt": "Catch the matching letters!",
      "rules": {
        "letterSet": "word_letters",
        "targetWord": "DOG",
        "fallSpeed": 1,
        "itemCount": 5
      },
      "scoring": {
        "pointsPerCorrect": 8,
        "wrongPenalty": 1
      }
    },
    "sentence_finish": {
      "kind": "choice_prompt",
      "title": "Sentence Finish",
      "prompt": "Finish the sentence!",
      "rules": {
        "promptSet": "sentence_completion",
        "fallSpeed": 1,
        "answerCount": 3
      },
      "scoring": {
        "pointsPerCorrect": 10,
        "wrongPenalty": 0
      }
    },
    "opposites": {
      "kind": "choice_prompt",
      "title": "Opposites",
      "prompt": "Catch the opposite word!",
      "rules": {
        "promptSet": "opposites",
        "fallSpeed": 1,
        "answerCount": 4
      },
      "scoring": {
        "pointsPerCorrect": 10,
        "wrongPenalty": 0
      }
    },
    "synonyms": {
      "kind": "choice_prompt",
      "title": "Synonyms",
      "prompt": "Catch the similar word!",
      "rules": {
        "promptSet": "synonyms",
        "fallSpeed": 1,
        "answerCount": 4
      },
      "scoring": {
        "pointsPerCorrect": 10,
        "wrongPenalty": 0
      }
    },
    "riddle_catch": {
      "kind": "choice_prompt",
      "title": "Riddle Catch",
      "prompt": "Catch the answer!",
      "rules": {
        "promptSet": "riddle",
        "fallSpeed": 0.9,
        "answerCount": 4
      },
      "scoring": {
        "pointsPerCorrect": 15,
        "wrongPenalty": 0
      }
    }
  }
}
